{
  "concept_ids": [
    "concept.dataset.recordset",
    "concept.dataset.record-id",
    "concept.dataset.source"
  ],
  "description": "Aggregate, field, row, cross-field, and source-quality questions for record datasets.",
  "extensions": {
    "question-pack.maturity": "reference"
  },
  "id": "question-pack.generic-tabular",
  "interrogation_model_version": "0.1",
  "license": "MIT",
  "questions": [
    {
      "abstain_when": [],
      "checks": [
        {
          "capability": "quality.placeholder-check",
          "cost_tier": 1,
          "effect": "",
          "evidence_kinds": [
            "evidence.aggregate",
            "evidence.row-identities"
          ],
          "mode": "deterministic",
          "optional": false,
          "permission": ""
        }
      ],
      "concept_ids": [
        "concept.dataset.recordset"
      ],
      "dependencies": [],
      "evidence_required": [
        "evidence.affected-count"
      ],
      "extensions": {},
      "finding_code": "data.placeholder-values",
      "id": "question.generic-tabular.placeholders",
      "interrogation_model_version": "0.1",
      "jurisdictions": [],
      "preconditions": [
        "precondition.records-available"
      ],
      "privacy_class": "privacy.aggregate",
      "question": "Which fields contain blanks, sentinels, test values, or placeholder tokens?",
      "references": [
        {
          "id": "reference.w3c-dqv",
          "jurisdiction": "",
          "license": "",
          "notes": "",
          "revision": "",
          "role": "reference.quality-vocabulary",
          "url": "https://www.w3.org/TR/vocab-dqv/"
        }
      ],
      "repair_families": [
        "repair.normalize-missing",
        "repair.quarantine-record"
      ],
      "scope": "dataset",
      "severity": "medium",
      "tags": [
        "domain.generic-tabular"
      ],
      "title": "Missing and placeholder values",
      "version": "1.0.0"
    },
    {
      "abstain_when": [],
      "checks": [
        {
          "capability": "quality.unicode-control-check",
          "cost_tier": 1,
          "effect": "",
          "evidence_kinds": [
            "evidence.aggregate",
            "evidence.row-identities"
          ],
          "mode": "deterministic",
          "optional": false,
          "permission": ""
        }
      ],
      "concept_ids": [
        "concept.dataset.recordset"
      ],
      "dependencies": [],
      "evidence_required": [
        "evidence.affected-count"
      ],
      "extensions": {},
      "finding_code": "data.unicode-or-control",
      "id": "question.generic-tabular.unicode-controls",
      "interrogation_model_version": "0.1",
      "jurisdictions": [],
      "preconditions": [
        "precondition.records-available"
      ],
      "privacy_class": "privacy.aggregate",
      "question": "Do values contain non-normalized Unicode, control characters, or invisible separators?",
      "references": [],
      "repair_families": [
        "repair.normalize-unicode",
        "repair.strip-controls"
      ],
      "scope": "dataset",
      "severity": "medium",
      "tags": [
        "domain.generic-tabular"
      ],
      "title": "Unicode and control characters",
      "version": "1.0.0"
    },
    {
      "abstain_when": [],
      "checks": [
        {
          "capability": "quality.whitespace-check",
          "cost_tier": 1,
          "effect": "",
          "evidence_kinds": [
            "evidence.aggregate",
            "evidence.row-identities"
          ],
          "mode": "deterministic",
          "optional": false,
          "permission": ""
        }
      ],
      "concept_ids": [
        "concept.dataset.recordset"
      ],
      "dependencies": [],
      "evidence_required": [
        "evidence.affected-count"
      ],
      "extensions": {},
      "finding_code": "data.whitespace-anomaly",
      "id": "question.generic-tabular.whitespace",
      "interrogation_model_version": "0.1",
      "jurisdictions": [],
      "preconditions": [
        "precondition.records-available"
      ],
      "privacy_class": "privacy.aggregate",
      "question": "Do text values contain leading, trailing, or repeated whitespace that changes matching?",
      "references": [],
      "repair_families": [
        "repair.trim-whitespace"
      ],
      "scope": "dataset",
      "severity": "low",
      "tags": [
        "domain.generic-tabular"
      ],
      "title": "Whitespace anomalies",
      "version": "1.0.0"
    },
    {
      "abstain_when": [],
      "checks": [
        {
          "capability": "quality.type-conformance-check",
          "cost_tier": 1,
          "effect": "",
          "evidence_kinds": [
            "evidence.aggregate",
            "evidence.row-identities"
          ],
          "mode": "deterministic",
          "optional": false,
          "permission": ""
        }
      ],
      "concept_ids": [
        "concept.dataset.recordset"
      ],
      "dependencies": [],
      "evidence_required": [
        "evidence.affected-count"
      ],
      "extensions": {},
      "finding_code": "data.type-nonconformance",
      "id": "question.generic-tabular.type-conformance",
      "interrogation_model_version": "0.1",
      "jurisdictions": [],
      "preconditions": [
        "precondition.records-available"
      ],
      "privacy_class": "privacy.aggregate",
      "question": "Do values conform to the inferred or declared field type without silent coercion?",
      "references": [
        {
          "id": "reference.w3c-shacl",
          "jurisdiction": "",
          "license": "",
          "notes": "",
          "revision": "",
          "role": "reference.constraint-language",
          "url": "https://www.w3.org/TR/shacl/"
        }
      ],
      "repair_families": [],
      "scope": "dataset",
      "severity": "high",
      "tags": [
        "domain.generic-tabular"
      ],
      "title": "Observed type conformance",
      "version": "1.0.0"
    },
    {
      "abstain_when": [],
      "checks": [
        {
          "capability": "quality.duplicate-record-check",
          "cost_tier": 1,
          "effect": "",
          "evidence_kinds": [
            "evidence.aggregate",
            "evidence.row-identities"
          ],
          "mode": "deterministic",
          "optional": false,
          "permission": ""
        }
      ],
      "concept_ids": [
        "concept.dataset.recordset"
      ],
      "dependencies": [],
      "evidence_required": [
        "evidence.affected-count"
      ],
      "extensions": {},
      "finding_code": "data.duplicate-record",
      "id": "question.generic-tabular.duplicate-rows",
      "interrogation_model_version": "0.1",
      "jurisdictions": [],
      "preconditions": [
        "precondition.records-available"
      ],
      "privacy_class": "privacy.aggregate",
      "question": "Are exact duplicate records present, and are they expected repetitions or ingestion errors?",
      "references": [],
      "repair_families": [
        "repair.quarantine-duplicate"
      ],
      "scope": "dataset",
      "severity": "medium",
      "tags": [
        "domain.generic-tabular"
      ],
      "title": "Duplicate records",
      "version": "1.0.0"
    },
    {
      "abstain_when": [],
      "checks": [
        {
          "capability": "quality.identifier-uniqueness-check",
          "cost_tier": 1,
          "effect": "",
          "evidence_kinds": [
            "evidence.aggregate",
            "evidence.row-identities"
          ],
          "mode": "deterministic",
          "optional": false,
          "permission": ""
        }
      ],
      "concept_ids": [
        "concept.dataset.record-id"
      ],
      "dependencies": [],
      "evidence_required": [
        "evidence.affected-count"
      ],
      "extensions": {},
      "finding_code": "data.identifier-duplicate",
      "id": "question.generic-tabular.identifier-uniqueness",
      "interrogation_model_version": "0.1",
      "jurisdictions": [],
      "preconditions": [
        "precondition.records-available",
        "precondition.identifier-available"
      ],
      "privacy_class": "privacy.aggregate",
      "question": "Do identifier-like fields remain unique where the data contract requires uniqueness?",
      "references": [],
      "repair_families": [],
      "scope": "dataset",
      "severity": "high",
      "tags": [
        "domain.generic-tabular"
      ],
      "title": "Identifier uniqueness",
      "version": "1.0.0"
    },
    {
      "abstain_when": [],
      "checks": [
        {
          "capability": "quality.conditional-missingness-check",
          "cost_tier": 3,
          "effect": "",
          "evidence_kinds": [
            "evidence.aggregate",
            "evidence.row-identities"
          ],
          "mode": "deterministic",
          "optional": false,
          "permission": ""
        },
        {
          "capability": "quality.interpret-missingness",
          "cost_tier": 7,
          "effect": "model.invoke",
          "evidence_kinds": [
            "evidence.structured-model-output",
            "evidence.prompt-digest"
          ],
          "mode": "llm",
          "optional": true,
          "permission": "model.invoke"
        }
      ],
      "concept_ids": [
        "concept.dataset.recordset"
      ],
      "dependencies": [],
      "evidence_required": [
        "evidence.missingness-matrix",
        "evidence.group-counts"
      ],
      "extensions": {},
      "finding_code": "data.conditional-missingness",
      "id": "question.generic-tabular.conditional-missingness",
      "interrogation_model_version": "0.1",
      "jurisdictions": [],
      "preconditions": [
        "precondition.records-available"
      ],
      "privacy_class": "privacy.aggregate",
      "question": "Does missingness change materially by source, time, geography, or entity type?",
      "references": [],